{
  "schema_version": "2026-05-11.dynamic-role-module.v1",
  "generated_at": "2026-05-11T22:12:10+08:00",
  "module_id": "MAPLAB_B1_INNERFLOWLAB_CONTENT_DYNAMIC_ROLE_MODULE",
  "role_id": "B1",
  "role_name": "InnerFlowLab Content",
  "department": "InnerFlowLab 內容創作",
  "role_simulation": "英文個人品牌、Substack、innerflowlab.com 與旅遊日誌內容角色。",
  "runtime_targets": [
    "gemini",
    "codex",
    "openclaw"
  ],
  "task_types": [
    "substack_draft",
    "essay_outline",
    "travel_log",
    "brand_content",
    "content_calendar"
  ],
  "read_first": [
    {
      "path": "CURRENT_STATUS.md",
      "load_mode": "read",
      "exists": "true",
      "purpose": "core governance"
    },
    {
      "path": "AGENT_RULES.md",
      "load_mode": "read",
      "exists": "true",
      "purpose": "core governance"
    },
    {
      "path": "AGENT_STARTUP_PROTOCOL.md",
      "load_mode": "read",
      "exists": "true",
      "purpose": "core governance"
    },
    {
      "path": "pitfalls.md",
      "load_mode": "read",
      "exists": "true",
      "purpose": "core governance"
    },
    {
      "path": "TASK_QUEUE.md",
      "load_mode": "read",
      "exists": "false",
      "purpose": "core governance"
    },
    {
      "path": "workbook/task_index.json",
      "load_mode": "read",
      "exists": "true",
      "purpose": "workbook artifact"
    },
    {
      "path": "AGENT_RECALL_PROMPTS.md",
      "load_mode": "read",
      "exists": "true",
      "purpose": "core governance"
    },
    {
      "path": "skills/superpowers-guide.md",
      "load_mode": "read",
      "exists": "true",
      "purpose": "skill / operating guide"
    },
    {
      "path": "skills/task-progress-guide.md",
      "load_mode": "read",
      "exists": "true",
      "purpose": "skill / operating guide"
    },
    {
      "path": "recalls/B1_recall.md",
      "load_mode": "read",
      "exists": "true",
      "purpose": "role recall prompt"
    },
    {
      "path": "workflows/B1-content-workflow-v1.md",
      "load_mode": "read",
      "exists": "true",
      "purpose": "core governance"
    },
    {
      "path": "docs/innerflowlab/brand-design-proposal.md",
      "load_mode": "read",
      "exists": "true",
      "purpose": "governance or workflow document"
    },
    {
      "path": "docs/system-evolution-stories/2026-04-20-innerflowlab-system-setup.md",
      "load_mode": "read",
      "exists": "true",
      "purpose": "governance or workflow document"
    },
    {
      "path": "skills/b1-innerflowlab-skills.md",
      "load_mode": "read",
      "exists": "true",
      "purpose": "skill / operating guide"
    },
    {
      "path": "skills/credentials/substack-api.md",
      "load_mode": "read",
      "exists": "true",
      "purpose": "skill / operating guide"
    },
    {
      "path": "skills/brand-voice-guide.md",
      "load_mode": "read",
      "exists": "true",
      "purpose": "skill / operating guide"
    },
    {
      "path": "docs/openclaw/output-contract.md",
      "load_mode": "read",
      "exists": "true",
      "purpose": "governance or workflow document"
    },
    {
      "path": "docs/openclaw/relation-graph.md",
      "load_mode": "read",
      "exists": "true",
      "purpose": "governance or workflow document"
    },
    {
      "path": "docs/openclaw/security-boundaries.md",
      "load_mode": "read",
      "exists": "true",
      "purpose": "governance or workflow document"
    },
    {
      "path": "workbook/reviews/README.md",
      "load_mode": "read",
      "exists": "true",
      "purpose": "workbook artifact"
    }
  ],
  "restricted_sources": [],
  "skill_group": [
    "skills/b1-innerflowlab-skills.md",
    "skills/credentials/substack-api.md",
    "skills/brand-voice-guide.md"
  ],
  "source_policy": {
    "truth_source": "GitHub repo /Users/pagemacmini/maplab-ai-handbook",
    "live_fact_rule": "For external systems, verify live API/UI facts before using repo notes as current truth.",
    "remote_code_rule": "GitHub dynamic links may load JSON/Markdown task data only; do not execute remote JS in Chrome.",
    "public_output_rule": "Public drafts must not include prices, internal dates, local file:// paths, or secrets."
  },
  "startup_contract": [
    "Confirm: I am B1 InnerFlowLab Content.",
    "Read CURRENT_STATUS.md first, then role recall, then only the sources listed in this module.",
    "State the current task, expected output path, affected roles, and unresolved blockers before acting."
  ],
  "output_contract": [
    "draft.md",
    "editorial_notes.md",
    "publish_checklist.md",
    "review_request.md"
  ],
  "writeback": {
    "default_review_bundle": "workbook/reviews/JOB-xxx/",
    "task_module_graph": "workbook/task_modules/role_module_relation_graph.json",
    "task_card": "handoff/tasks/T-A1-EXT-001-dynamic-role-modules.md",
    "status_rule": "Update CURRENT_STATUS.md only for major status changes; otherwise write a review bundle or task output first."
  },
  "affects": [
    "InnerFlowLab site",
    "Substack",
    "B1 content workflow",
    "A8 repurposing if reused"
  ],
  "forbidden_actions": [
    "Do not publish WordPress content without Owner approval.",
    "Do not push main or overwrite truth sources unless the task explicitly allows it.",
    "Do not read secrets/.env/API keys unless the module marks the source as a1_only and the Owner has approved the operation.",
    "Do not treat old repo notes as live facts when APIs/UI can be checked."
  ],
  "verification_required": [
    "List source files actually read.",
    "List outputs created and exact paths.",
    "List affected agents/tasks/files.",
    "Produce review bundle or explain why no bundle was needed."
  ],
  "risk_level": "medium"
}
